{
  "cedar_shallow_oracle": "vouch.cedar-shallow-oracle/v0",
  "version": "1.3.11",
  "generator": {
    "script": "scripts/check-cedar-shallow-oracle.mjs",
    "seed": "W2.1-cedar-shallow-oracle-0001",
    "mode": "transcription-fidelity-oracle-harness"
  },
  "source_snapshot": [
    {
      "path": "docs/LISPEX-VOUCH-BLUEPRINT-v1.0.md",
      "sha256": "6ba44b4605f8bbf93f9c2071ccaed697fdcbd7a29b21649a1572893b680fbb9e"
    },
    {
      "path": "transcription/cedar-shallow/policies/specific-photo.cedar",
      "sha256": "500a4d652df19c803bf42731113d6a73151a440def8d3b511ea6e8288a35f980"
    },
    {
      "path": "transcription/cedar-shallow/lispex/specific-photo.lspx",
      "sha256": "e5f99e7cdc633ec6c526c27aacd55016de00a94a09bca67939e8dacd2ec565f9"
    },
    {
      "path": "transcription/cedar-shallow/policies/owner-or-public-photo.cedar",
      "sha256": "98b0ed427dfe53f5e77167de53df45df2050bf9daee26c624846d0d78af3d764"
    },
    {
      "path": "transcription/cedar-shallow/lispex/owner-or-public-photo.lspx",
      "sha256": "247bd8e123c18498e00737f1ce54c51ad0b208a460670638de2fe35edd3bde30"
    },
    {
      "path": "scripts/cedar-shallow-oracle-lib.mjs",
      "sha256": "85036f12b6e2f6f663173c153ec9b4b1349cd47081239efdabf5e3dd9447878a"
    },
    {
      "path": "scripts/check-cedar-shallow-oracle.mjs",
      "sha256": "116a2133ed07d54ea7a947c46c46d46d5c1bd9e71761f5c485a14e27e3d72f75"
    },
    {
      "path": "scripts/gen-cedar-shallow-oracle.mjs",
      "sha256": "558cd9bb61258df9f25edffd28e662e06a087b530b123986e01a0c3e0505cbce"
    }
  ],
  "rules": [
    {
      "rule_id": "cedar-specific-photo",
      "source_system": "Cedar",
      "upstream_version": "cedar-policy-language-reference-v4.5-shallow-examples",
      "upstream_commit_or_container": "not-used-local-policy-text",
      "parameter_data_hashes": [],
      "comparability": "after-declared-map",
      "input_map": "lispex-list-to-cedar-request/v0",
      "output_map": "cedar-decision-to-lispex-decision/v0",
      "oracle_strength": "documented-example-compatible-local-evaluator",
      "upstream_policy_path": "transcription/cedar-shallow/policies/specific-photo.cedar",
      "lispex_source_path": "transcription/cedar-shallow/lispex/specific-photo.lspx"
    },
    {
      "rule_id": "cedar-owner-or-public-photo",
      "source_system": "Cedar",
      "upstream_version": "cedar-policy-language-reference-v4.5-shallow-examples",
      "upstream_commit_or_container": "not-used-local-policy-text",
      "parameter_data_hashes": [],
      "comparability": "after-declared-map",
      "input_map": "lispex-list-to-cedar-request/v0",
      "output_map": "cedar-decision-to-lispex-decision/v0",
      "oracle_strength": "documented-example-compatible-local-evaluator",
      "upstream_policy_path": "transcription/cedar-shallow/policies/owner-or-public-photo.cedar",
      "lispex_source_path": "transcription/cedar-shallow/lispex/owner-or-public-photo.lspx"
    }
  ],
  "cases": [
    {
      "case_id": {
        "generator_commit": "b490bbc021557b9d1f7cb49183127de12b6baa62",
        "seed": "W2.1-cedar-shallow-oracle-0001",
        "index": 0
      },
      "rule_id": "cedar-specific-photo",
      "input_hash": {
        "domain": "csk/profile-input-hash/v0",
        "hex": "56f27747d94d0d5cf0b7775b7ce7432d4459918b93dac6fdda56d046c225721c"
      },
      "input_datum": "(\"alice\" \"view\" \"VacationPhoto94.jpg\")",
      "upstream_input": {
        "principal": "alice",
        "action": "view",
        "resource": {
          "type": "Photo",
          "id": "VacationPhoto94.jpg"
        }
      },
      "upstream_output": "permit",
      "mapped_upstream_decision": "(decision allow)",
      "lispex_transcript": [
        "(decision allow)"
      ],
      "receipt_comparison_status": "agree",
      "fault_class": null,
      "outcome": "agree",
      "first_divergence": null,
      "cause": null,
      "resolution": null
    },
    {
      "case_id": {
        "generator_commit": "b490bbc021557b9d1f7cb49183127de12b6baa62",
        "seed": "W2.1-cedar-shallow-oracle-0001",
        "index": 1
      },
      "rule_id": "cedar-specific-photo",
      "input_hash": {
        "domain": "csk/profile-input-hash/v0",
        "hex": "9867826defe114d88a9a87ca10f73e594191a67fea34f0cda76121696a90fe0e"
      },
      "input_datum": "(\"alice\" \"view\" \"VacationPhoto95.jpg\")",
      "upstream_input": {
        "principal": "alice",
        "action": "view",
        "resource": {
          "type": "Photo",
          "id": "VacationPhoto95.jpg"
        }
      },
      "upstream_output": "deny",
      "mapped_upstream_decision": "(decision deny)",
      "lispex_transcript": [
        "(decision deny)"
      ],
      "receipt_comparison_status": "agree",
      "fault_class": null,
      "outcome": "agree",
      "first_divergence": null,
      "cause": null,
      "resolution": null
    },
    {
      "case_id": {
        "generator_commit": "b490bbc021557b9d1f7cb49183127de12b6baa62",
        "seed": "W2.1-cedar-shallow-oracle-0001",
        "index": 2
      },
      "rule_id": "cedar-specific-photo",
      "input_hash": {
        "domain": "csk/profile-input-hash/v0",
        "hex": "e858f30dcf7fb1f92ea2a8349e2fec7cbc8b35c3b4083c2424ca378a16fb1e5c"
      },
      "input_datum": "(\"alice\" \"view\" \"Report.pdf\")",
      "upstream_input": {
        "principal": "alice",
        "action": "view",
        "resource": {
          "type": "Document",
          "id": "Report.pdf"
        }
      },
      "upstream_output": "deny",
      "mapped_upstream_decision": "(decision deny)",
      "lispex_transcript": [
        "(decision deny)"
      ],
      "receipt_comparison_status": "agree",
      "fault_class": null,
      "outcome": "agree",
      "first_divergence": null,
      "cause": null,
      "resolution": null
    },
    {
      "case_id": {
        "generator_commit": "b490bbc021557b9d1f7cb49183127de12b6baa62",
        "seed": "W2.1-cedar-shallow-oracle-0001",
        "index": 3
      },
      "rule_id": "cedar-specific-photo",
      "input_hash": {
        "domain": "csk/profile-input-hash/v0",
        "hex": "fce271ddab2630921f7bafbe5eb4c8d2b87889776e328ac56facc8e5dfeb0428"
      },
      "input_datum": "(\"alice\" \"view\" \"\")",
      "upstream_input": {
        "principal": "alice",
        "action": "view",
        "resource": {
          "type": "Photo",
          "id": ""
        }
      },
      "upstream_output": "deny",
      "mapped_upstream_decision": "(decision deny)",
      "lispex_transcript": [
        "(decision deny)"
      ],
      "receipt_comparison_status": "agree",
      "fault_class": null,
      "outcome": "agree",
      "first_divergence": null,
      "cause": null,
      "resolution": null
    },
    {
      "case_id": {
        "generator_commit": "b490bbc021557b9d1f7cb49183127de12b6baa62",
        "seed": "W2.1-cedar-shallow-oracle-0001",
        "index": 4
      },
      "rule_id": "cedar-specific-photo",
      "input_hash": {
        "domain": "csk/profile-input-hash/v0",
        "hex": "88c159b8a134528e4ada2461d9b57c0bc417f39566e3ca3b5d1f9341db38ab9d"
      },
      "input_datum": "(\"alice\" \"edit\" \"VacationPhoto94.jpg\")",
      "upstream_input": {
        "principal": "alice",
        "action": "edit",
        "resource": {
          "type": "Photo",
          "id": "VacationPhoto94.jpg"
        }
      },
      "upstream_output": "deny",
      "mapped_upstream_decision": "(decision deny)",
      "lispex_transcript": [
        "(decision deny)"
      ],
      "receipt_comparison_status": "agree",
      "fault_class": null,
      "outcome": "agree",
      "first_divergence": null,
      "cause": null,
      "resolution": null
    },
    {
      "case_id": {
        "generator_commit": "b490bbc021557b9d1f7cb49183127de12b6baa62",
        "seed": "W2.1-cedar-shallow-oracle-0001",
        "index": 5
      },
      "rule_id": "cedar-specific-photo",
      "input_hash": {
        "domain": "csk/profile-input-hash/v0",
        "hex": "01aebda81ab9797dd4dfb77b7a5494eae9804e5f09b6df73a73b8b54d1ec0f0d"
      },
      "input_datum": "(\"alice\" \"edit\" \"VacationPhoto95.jpg\")",
      "upstream_input": {
        "principal": "alice",
        "action": "edit",
        "resource": {
          "type": "Photo",
          "id": "VacationPhoto95.jpg"
        }
      },
      "upstream_output": "deny",
      "mapped_upstream_decision": "(decision deny)",
      "lispex_transcript": [
        "(decision deny)"
      ],
      "receipt_comparison_status": "agree",
      "fault_class": null,
      "outcome": "agree",
      "first_divergence": null,
      "cause": null,
      "resolution": null
    },
    {
      "case_id": {
        "generator_commit": "b490bbc021557b9d1f7cb49183127de12b6baa62",
        "seed": "W2.1-cedar-shallow-oracle-0001",
        "index": 6
      },
      "rule_id": "cedar-specific-photo",
      "input_hash": {
        "domain": "csk/profile-input-hash/v0",
        "hex": "5bd282a40051e32af2ab91e9b4a495531b40aca2fa821ad30d9c38b12577d9d7"
      },
      "input_datum": "(\"alice\" \"edit\" \"Report.pdf\")",
      "upstream_input": {
        "principal": "alice",
        "action": "edit",
        "resource": {
          "type": "Document",
          "id": "Report.pdf"
        }
      },
      "upstream_output": "deny",
      "mapped_upstream_decision": "(decision deny)",
      "lispex_transcript": [
        "(decision deny)"
      ],
      "receipt_comparison_status": "agree",
      "fault_class": null,
      "outcome": "agree",
      "first_divergence": null,
      "cause": null,
      "resolution": null
    },
    {
      "case_id": {
        "generator_commit": "b490bbc021557b9d1f7cb49183127de12b6baa62",
        "seed": "W2.1-cedar-shallow-oracle-0001",
        "index": 7
      },
      "rule_id": "cedar-specific-photo",
      "input_hash": {
        "domain": "csk/profile-input-hash/v0",